# name: test/sql/types/blob/test_blob_function.test
# description: BLOB with Functions
# group: [blob]

statement ok
PRAGMA enable_verification

statement ok
CREATE TABLE blobs (b varbinary);

statement error
INSERT INTO blobs VALUES ('a'::binary)

statement ok
INSERT INTO blobs VALUES (x'aa'::binary), (x'bbcc')

query I
SELECT COUNT(*) FROM blobs
----
2

# octet_length
query I
SELECT OCTET_LENGTH(b) FROM blobs ORDER BY 1
----
1
2

# HEX strings
statement ok
DELETE FROM blobs

statement ok
INSERT INTO blobs VALUES (x'FF'::binary)

query T
SELECT b || x'BB'::varbinary FROM blobs
----
ffbb

query T
SELECT b || x'5A5A'::varbinary FROM blobs
----
ff5a5a

# BLOB || VARCHAR is not allowed, should fail
statement error
SELECT b || '5A5A'::VARCHAR FROM blobs

# Octet Length tests
statement ok
DELETE FROM blobs

statement ok
INSERT INTO blobs VALUES (x'FF'::binary)

statement error
INSERT INTO blobs VALUES ('FF'::varbinary)

statement ok
INSERT INTO blobs VALUES (x'55AAFF55AAFF55AAFF01'::varbinary)

statement error
INSERT INTO blobs VALUES ('55AAFF55AAFF55AAFF01'::varbinary)

query I
SELECT OCTET_LENGTH(b) FROM blobs ORDER BY 1
----
1
10

query I
SELECT OCTET_LENGTH('TEST')
----
4

query I
SELECT OCTET_LENGTH('我愛Java')
----
10

query I
SELECT OCTET_LENGTH(x'012F')
----
2

query T
SELECT OCTET_LENGTH(NULL)
----
null
