# name: test/sql/update/test_null_update.test
# description: Test standard update behavior with NULLs
# group: [update]

# create a table
statement ok con1
CREATE TABLE test (a INTEGER);

statement ok
INSERT INTO test VALUES (1), (2), (3), (NULL)

query I
SELECT * FROM test ORDER BY a
----
NULL
1
2
3

statement ok
UPDATE test SET a=NULL WHERE a=2

# not seen yet by con2, only by con1
query I
SELECT * FROM test ORDER BY a
----
NULL
NULL
1
3

query I
SELECT * FROM test ORDER BY a
----
NULL
NULL
1
3

